{"compatibility":{"addon_max":null,"addon_min":"0.1","build_max":120999,"build_min":120000,"desktop_max":null,"desktop_min":"0.1","interface_max":120999,"interface_min":120000,"wow_product":"retail"},"evidence":{"confidence_interval_percent":null,"expires_at":"2027-01-01T00:00:00Z","limitations":["synthetic_fixture_only","not_live_balance_guidance"],"method":null,"run_count":null,"source_hashes":{},"source_ids":["synthetic_contract_fixture"],"tier":"static_fallback_template"},"guidance":{"statements":[{"alternatives":[],"order":1,"prerequisites":["synthetic_state_ready"],"text_key":"synthetic.priority.first","type":"priority"},{"alternatives":["synthetic.priority.first"],"order":2,"prerequisites":[],"text_key":"synthetic.check.review_context","type":"check"}],"unsupported_variables":["live_balance","exact_stat_weights","best_in_slot"]},"identity":{"channel":"stable","content_version":"0.1.0","created_at":"2026-07-29T00:00:00Z","package_id":"synthetic.retail.damage.001"},"integrity":{"payload_sha256":"4a99e7ead86a4f60ba9ba28dca92e6fadae05705e466b9dd8506d927813cdfc7","publisher_key_id":"placeholder.local.001","signature":null,"signature_algorithm":"placeholder-none"},"safety":{"degradation_policy":"fail_closed","invalidation_reasons":["unknown_build","expired_evidence","subject_mismatch"],"no_automation":true,"required_warnings":["synthetic_fixture","not_personalized_simulation"]},"schema_version":"0.1","subject":{"character_fingerprint":null,"class_id":1,"content_contexts":["synthetic_single_target"],"level_max":80,"level_min":80,"race_ids":null,"role":"damage","specialization_id":71}}
